title,price,location,link
"Apartamento com 2 dormitórios à venda, 43 m² por R$ 146.410 - Jardim Residencial Paraíso -",R$ 146.411,"Araraquara, Jardim Residencial Paraíso",https://sp.olx.com.br/regiao-de-ribeirao-preto/imoveis/apartamento-com-2-dormitorios-a-venda-43-m-por-r-146-410-jardim-residencial-paraiso-1472967384
"Apartamento com 2 dormitórios à venda, 47 m² por R$ 138.229,04 - Jardim Europa (Vila Xavie",R$ 138.229,"Araraquara, Jardim Europa (Vila Xavier)",https://sp.olx.com.br/regiao-de-ribeirao-preto/imoveis/apartamento-com-2-dormitorios-a-venda-47-m-por-r-138-229-04-jardim-europa-vila-xavie-1472967374
"Apartamento com 2 dormitórios à venda, 46 m² por R$ 160.432 - Parque Laranjeiras - Araraqu",R$ 160.432,"Araraquara, Parque Laranjeiras",https://sp.olx.com.br/regiao-de-ribeirao-preto/imoveis/apartamento-com-2-dormitorios-a-venda-46-m-por-r-160-432-parque-laranjeiras-araraqu-1472967226
"Casa com 2 dormitórios à venda, 50 m² por R$ 153.758 - Jardim Ipê Amarelo - Araraquara/SP",R$ 153.758,"Araraquara, Jardim Ipê Amarelo",https://sp.olx.com.br/regiao-de-ribeirao-preto/imoveis/casa-com-2-dormitorios-a-venda-50-m-por-r-153-758-jardim-ipe-amarelo-araraquara-sp-1472967078
"Apartamento com 2 dormitórios à venda, 39 m² por R$ 118.624 - Jardim Das Flores - Araraqua",R$ 118.625,"Araraquara, Jardim das Flores",https://sp.olx.com.br/regiao-de-ribeirao-preto/imoveis/apartamento-com-2-dormitorios-a-venda-39-m-por-r-118-624-jardim-das-flores-araraqua-1472966919
"Apartamento com 2 dormitórios à venda, 43 m² por R$ 182.358 - Jardim Brasil Vila Xavier -",R$ 182.358,"Araraquara, Jardim Brasil (Vila Xavier)",https://sp.olx.com.br/regiao-de-ribeirao-preto/imoveis/apartamento-com-2-dormitorios-a-venda-43-m-por-r-182-358-jardim-brasil-vila-xavier-1472966813
"Apartamento com 2 dormitórios à venda, 65 m² por R$ 155.198 - Jardim Residencial Paraíso -",R$ 155.198,"Araraquara, Jardim Residencial Paraíso",https://sp.olx.com.br/regiao-de-ribeirao-preto/imoveis/apartamento-com-2-dormitorios-a-venda-65-m-por-r-155-198-jardim-residencial-paraiso-1472966828
Casa Padrão em Araraquara,R$ 310.000,"Araraquara, Jardim Indaiá",https://sp.olx.com.br/regiao-de-ribeirao-preto/imoveis/casa-padrao-em-araraquara-1472966657
Casa Padrão em Araraquara,R$ 220.000,"Araraquara, Vila Xavier (Vila Xavier)",https://sp.olx.com.br/regiao-de-ribeirao-preto/imoveis/casa-padrao-em-araraquara-1472966652
Casa Padrão em Araraquara,R$ 320.000,"Araraquara, Centro",https://sp.olx.com.br/regiao-de-ribeirao-preto/imoveis/casa-padrao-em-araraquara-1472966607
Casa Condomínio Flamboyants,R$ 645.000,"Araraquara, Jardim dos Flamboyants",https://sp.olx.com.br/regiao-de-ribeirao-preto/imoveis/casa-condominio-flamboyants-1472960691
"Apartamento com 3 dormitórios à venda e locação no Edifício Jardim Tropical, 81 m² por R$",R$ 350.000,"Araraquara, Vila Melhado",https://sp.olx.com.br/regiao-de-ribeirao-preto/imoveis/apartamento-com-3-dormitorios-a-venda-e-locacao-no-edificio-jardim-tropical-81-m-por-r-1472941091
"Casa com 3 dormitórios à venda, 168 m² por R$ 692.000,00 - Parque Laranjeiras - Araraquara",R$ 692.000,"Araraquara, Parque Laranjeiras",https://sp.olx.com.br/regiao-de-ribeirao-preto/imoveis/casa-com-3-dormitorios-a-venda-168-m-por-r-692-000-00-parque-laranjeiras-araraquara-1472937577
Apartamento Altos do Botânico Residencial 3 Quartos sendo 1 Suíte,R$ 390.000,"Araraquara, Jardim Botânico",https://sp.olx.com.br/regiao-de-ribeirao-preto/imoveis/apartamento-altos-do-botanico-residencial-3-quartos-sendo-1-suite-1422516670
Vendo casa em Américo Brasiliense,R$ 80.000,"Araraquara, Jardim Morumbi",https://sp.olx.com.br/regiao-de-ribeirao-preto/imoveis/vendo-casa-em-americo-brasiliense-1472906404
"CASA EM TERRENO DE 476 M2 EM ARARAQUARA NA REGIÃO CENTRAL,",R$ 700.000,"Araraquara, Centro",https://sp.olx.com.br/regiao-de-ribeirao-preto/imoveis/casa-em-terreno-de-476-m2-em-araraquara-na-regiao-central-1455363563
apartamento térreo 2 dormitórios 1 vaga pronto para morar - jardim quitandinha - araraquar,R$ 175.000,"Araraquara, Solidariedade",https://sp.olx.com.br/regiao-de-ribeirao-preto/imoveis/apartamento-terreo-2-dormitorios-1-vaga-pronto-para-morar-jardim-quitandinha-araraquar-1470863205
Apartamento novo com condomínio clube,R$ 184.000,"Araraquara, Jardim Brasil (Vila Xavier)",https://sp.olx.com.br/regiao-de-ribeirao-preto/imoveis/apartamento-novo-com-condominio-clube-1472796446
Casa à venda 3 quartos no Santa Angelina - Araraquara / SP,R$ 550.000,"Araraquara, Jardim Santa Angelina",https://sp.olx.com.br/regiao-de-ribeirao-preto/imoveis/casa-a-venda-3-quartos-no-santa-angelina-araraquara-sp-1472793468
Casa à venda 3 quartos no Condomínio Alto da Boa Vista - Araraquara / SP,R$ 490.000,"Araraquara, 7º Distrito Industrial (Antonio Zanin)",https://sp.olx.com.br/regiao-de-ribeirao-preto/imoveis/casa-a-venda-3-quartos-no-condominio-alto-da-boa-vista-araraquara-sp-1472792535
Venda-Apartamento-Araraquara-Centro,R$ 280.000,"Araraquara, Centro",https://sp.olx.com.br/regiao-de-ribeirao-preto/imoveis/venda-apartamento-araraquara-centro-1472777912
Venda-Casa-Araraquara-Parque Gramado II,R$ 320.000,"Araraquara, Parque Gramado II",https://sp.olx.com.br/regiao-de-ribeirao-preto/imoveis/venda-casa-araraquara-parque-gramado-ii-1472777875
Venda-Casa-Araraquara-Village Damha II,R$ 1.490.000,"Araraquara, Residencial Village Damha II",https://sp.olx.com.br/regiao-de-ribeirao-preto/imoveis/venda-casa-araraquara-village-damha-ii-1472777887
Venda-Apartamento-Araraquara-Vitta Vistas do Botânico Flamboyants,R$ 310.000,"Araraquara, Residencial Cambuy",https://sp.olx.com.br/regiao-de-ribeirao-preto/imoveis/venda-apartamento-araraquara-vitta-vistas-do-botanico-flamboyants-1472777814
Venda-Casa de condomínio-Araraquara-Village Damha IV,R$ 1.280.000,"Araraquara, Residencial Village Damha IV",https://sp.olx.com.br/regiao-de-ribeirao-preto/imoveis/venda-casa-de-condominio-araraquara-village-damha-iv-1472777756
"2 dormitório(suíte) toda mobiliada, rica em armários, espaço gourmet **NOVA**",R$ 500.000,"Araraquara, Jardim Brasil (Vila Xavier)",https://sp.olx.com.br/regiao-de-ribeirao-preto/imoveis/2-dormitorio-suite-toda-mobiliada-rica-em-armarios-espaco-gourmet-nova-1472771430
Venda de Casas / Padrão na cidade de Araraquara,R$ 180.000,"Araraquara, Parque São Paulo (Vila Xavier)",https://sp.olx.com.br/regiao-de-ribeirao-preto/imoveis/venda-de-casas-padrao-na-cidade-de-araraquara-1472736680
Venda de Apartamentos / Padrão na cidade de Araraquara,R$ 350.000,"Araraquara, Jardim Residencial Paraíso",https://sp.olx.com.br/regiao-de-ribeirao-preto/imoveis/venda-de-apartamentos-padrao-na-cidade-de-araraquara-1472736689
Venda de Apartamentos / Padrão na cidade de Araraquara,R$ 350.000,"Araraquara, Jardim América (Vila Xavier)",https://sp.olx.com.br/regiao-de-ribeirao-preto/imoveis/venda-de-apartamentos-padrao-na-cidade-de-araraquara-1472736670
Venda de Casas / Padrão na cidade de Araraquara,R$ 149.999.330,"Araraquara, Centro",https://sp.olx.com.br/regiao-de-ribeirao-preto/imoveis/venda-de-casas-padrao-na-cidade-de-araraquara-1472736672
Venda de Apartamentos / Padrão na cidade de Araraquara,R$ 594.730,"Araraquara, Parque Atlanta",https://sp.olx.com.br/regiao-de-ribeirao-preto/imoveis/venda-de-apartamentos-padrao-na-cidade-de-araraquara-1472736537
Venda de Casas / Padrão na cidade de Araraquara,R$ 125.000,"Araraquara, Parque Residencial Iguatemi",https://sp.olx.com.br/regiao-de-ribeirao-preto/imoveis/venda-de-casas-padrao-na-cidade-de-araraquara-1472736432
Venda de Casas / Padrão na cidade de Araraquara,R$ 230.000,"Araraquara, Centro",https://sp.olx.com.br/regiao-de-ribeirao-preto/imoveis/venda-de-casas-padrao-na-cidade-de-araraquara-1472736431
Casa em Rua Dinamérico Duarte de Oliveira - Jardim Roberto Selmi Dei - Araraquara/SP,R$ 215.000,"Araraquara, Jardim Roberto Selmi Dei",https://sp.olx.com.br/regiao-de-ribeirao-preto/imoveis/casa-em-rua-dinamerico-duarte-de-oliveira-jardim-roberto-selmi-dei-araraquara-sp-1472699830
Casa de condomínio em Avenida Luiz Dosualdo - Jardim Gardênias - Araraquara/SP,R$ 290.000,"Araraquara, Jardim Gardênias",https://sp.olx.com.br/regiao-de-ribeirao-preto/imoveis/casa-de-condominio-em-avenida-luiz-dosualdo-jardim-gardenias-araraquara-sp-1472694270
Casa de condomínio em Rua Manoel Rodrigues Jacob - Jardim Santa Angelina - Araraquara/SP,R$ 330.000,"Araraquara, Jardim Santa Angelina",https://sp.olx.com.br/regiao-de-ribeirao-preto/imoveis/casa-de-condominio-em-rua-manoel-rodrigues-jacob-jardim-santa-angelina-araraquara-sp-1472693815
"Casa alvenaria, Bairro Sedenho",R$ 1.850.000,"Araraquara, Vila Sedenho",https://sp.olx.com.br/regiao-de-ribeirao-preto/imoveis/casa-alvenaria-bairro-sedenho-1471040492
Apartamento à venda no Parque Acanto 2 dormitórios - Araraquara,R$ 450.000,"Araraquara, Parque Residencial Iguatemi",https://sp.olx.com.br/regiao-de-ribeirao-preto/imoveis/apartamento-a-venda-no-parque-acanto-2-dormitorios-araraquara-1472668918
"Casa com 3 dormitórios à venda, 130 m² por R$ 450.000 - Jardim Nova América - Araraquara/S",R$ 270.000,"Araraquara, Jardim Nova América",https://sp.olx.com.br/regiao-de-ribeirao-preto/imoveis/casa-com-3-dormitorios-a-venda-130-m-por-r-450-000-jardim-nova-america-araraquara-s-1472655900
"Casa com 2 dormitórios à venda, 70 m² por R$ 230.000 - Jardim Veneza - Araraquara/SP",R$ 129.864,"Araraquara, Jardim Roberto Selmi Dei",https://sp.olx.com.br/regiao-de-ribeirao-preto/imoveis/casa-com-2-dormitorios-a-venda-70-m-por-r-230-000-jardim-veneza-araraquara-sp-1472655621
Apartamento a venda Reserva Dos Oitis,R$ 139.128,"Araraquara, Jardim dos Manacás",https://sp.olx.com.br/regiao-de-ribeirao-preto/imoveis/apartamento-a-venda-reserva-dos-oitis-1472651373
Excelente Casa no Condomínio Alea,R$ 165.536,"Araraquara, Parque Residencial Iguatemi",https://sp.olx.com.br/regiao-de-ribeirao-preto/imoveis/excelente-casa-no-condominio-alea-1472651187
Casa com 3 quartos e área com churrasqueira,R$ 154.481,"Araraquara, Vila Xavier (Vila Xavier)",https://sp.olx.com.br/regiao-de-ribeirao-preto/imoveis/casa-com-3-quartos-e-area-com-churrasqueira-1472641688
"Apartamento Padrão com 2 Dormitórios no Jardim Botânico, Araraquara",R$ 330.000,"Araraquara, Jardim Botânico",https://sp.olx.com.br/regiao-de-ribeirao-preto/imoveis/apartamento-padrao-com-2-dormitorios-no-jardim-botanico-araraquara-1472641627
Venda de Apartamentos / Padrão na cidade de Araraquara,R$ 250.000,"Araraquara, Vila Renata (Vila Xavier)",https://sp.olx.com.br/regiao-de-ribeirao-preto/imoveis/venda-de-apartamentos-padrao-na-cidade-de-araraquara-1472641513
Venda de Apartamentos / Padrão na cidade de Araraquara,R$ 190.000,"Araraquara, Jardim Botânico",https://sp.olx.com.br/regiao-de-ribeirao-preto/imoveis/venda-de-apartamentos-padrao-na-cidade-de-araraquara-1472641522
Venda de Apartamentos / Padrão na cidade de Araraquara,R$ 550.000,"Araraquara, Cidade Jardim",https://sp.olx.com.br/regiao-de-ribeirao-preto/imoveis/venda-de-apartamentos-padrao-na-cidade-de-araraquara-1472641489
Venda de Casas / Padrão na cidade de Araraquara,R$ 250.000,"Araraquara, Vila Sedenho",https://sp.olx.com.br/regiao-de-ribeirao-preto/imoveis/venda-de-casas-padrao-na-cidade-de-araraquara-1472641393
Apartamento perto da UNESP!,R$ 350.000,"Araraquara, Campos Ville",https://sp.olx.com.br/regiao-de-ribeirao-preto/imoveis/apartamento-perto-da-unesp-1472638210
Venda de Casas / Condomínio na cidade de Araraquara,R$ 190.000,"Araraquara, Vila Melhado",https://sp.olx.com.br/regiao-de-ribeirao-preto/imoveis/venda-de-casas-condominio-na-cidade-de-araraquara-1472613578
Venda de Casas / Condomínio na cidade de Araraquara,R$ 900.000,"Araraquara, Jardim Botânico",https://sp.olx.com.br/regiao-de-ribeirao-preto/imoveis/venda-de-casas-condominio-na-cidade-de-araraquara-1472610589
"Apartamento à venda, Parque da Pitangueiras, Araraquara, SP",R$ 270.000,"Araraquara, Jardim Bandeirantes",https://sp.olx.com.br/regiao-de-ribeirao-preto/imoveis/apartamento-a-venda-parque-da-pitangueiras-araraquara-sp-1472610165
"Apartamento com 2 dormitórios à venda, 39 m² por R$ 162.355 - Altos Do Jaraguá - Araraquar",R$ 162.356,"Araraquara, Altos do Jaraguá",https://sp.olx.com.br/regiao-de-ribeirao-preto/imoveis/apartamento-com-2-dormitorios-a-venda-39-m-por-r-162-355-altos-do-jaragua-araraquar-1472600698
"Apartamento com 2 dormitórios à venda, 39 m² por R$ 129.864 - Altos Do Jaraguá - Araraquar",R$ 129.864,"Araraquara, Altos do Jaraguá",https://sp.olx.com.br/regiao-de-ribeirao-preto/imoveis/apartamento-com-2-dormitorios-a-venda-39-m-por-r-129-864-altos-do-jaragua-araraquar-1472600541
"Apartamento com 2 dormitórios à venda, 39 m² por R$ 141.20 - Altos Do Jaraguá - Araraquara",R$ 141.207,"Araraquara, Altos do Jaraguá",https://sp.olx.com.br/regiao-de-ribeirao-preto/imoveis/apartamento-com-2-dormitorios-a-venda-39-m-por-r-141-20-altos-do-jaragua-araraquara-1472600038
"Apartamento com 2 dormitórios à venda, 43 m² por R$ 139.128 - Campos Ville - Araraquara/SP",R$ 139.128,"Araraquara, Campos Ville",https://sp.olx.com.br/regiao-de-ribeirao-preto/imoveis/apartamento-com-2-dormitorios-a-venda-43-m-por-r-139-128-campos-ville-araraquara-sp-1472599925
"Apartamento com 2 dormitórios à venda, 51 m² por R$ 169.374 - Cidade Jardim - Araraquara/S",R$ 169.375,"Araraquara, Cidade Jardim",https://sp.olx.com.br/regiao-de-ribeirao-preto/imoveis/apartamento-com-2-dormitorios-a-venda-51-m-por-r-169-374-cidade-jardim-araraquara-s-1472599324
"Apartamento com 2 dormitórios à venda, 51 m² por R$ 165.536 - Cidade Jardim - Araraquara/S",R$ 165.536,"Araraquara, Cidade Jardim",https://sp.olx.com.br/regiao-de-ribeirao-preto/imoveis/apartamento-com-2-dormitorios-a-venda-51-m-por-r-165-536-cidade-jardim-araraquara-s-1472598472
"Apartamento com 2 dormitórios à venda, 43 m² por R$ 119.735 - Campos Ville - Araraquara/SP",R$ 119.736,"Araraquara, Campos Ville",https://sp.olx.com.br/regiao-de-ribeirao-preto/imoveis/apartamento-com-2-dormitorios-a-venda-43-m-por-r-119-735-campos-ville-araraquara-sp-1472598198
"Apartamento com 2 dormitórios à venda, 43 m² por R$ 154.480 - Campos Ville - Araraquara/SP",R$ 154.481,"Araraquara, Campos Ville",https://sp.olx.com.br/regiao-de-ribeirao-preto/imoveis/apartamento-com-2-dormitorios-a-venda-43-m-por-r-154-480-campos-ville-araraquara-sp-1472598210
Venda apartamento vila Xavier Araraquara sp- 55m²,R$ 135.000,"Araraquara, Vila Cidade Industrial (Vila Xavier)",https://sp.olx.com.br/regiao-de-ribeirao-preto/imoveis/venda-apartamento-vila-xavier-araraquara-sp-55m-1472590736
Apto 2 dorms cond reserva dos oitis em Araraquara,R$ 330.000,"Araraquara, Jardim dos Manacás",https://sp.olx.com.br/regiao-de-ribeirao-preto/imoveis/apto-2-dorms-cond-reserva-dos-oitis-em-araraquara-1314112205
Oportunidade Imóvel no Jardim Universal,R$ 300.000,"Araraquara, Jardim Universal",https://sp.olx.com.br/regiao-de-ribeirao-preto/imoveis/oportunidade-imovel-no-jardim-universal-1472499130
Vendo Para Investimento - Casa Alugada no Jardim Dumont,R$ 250.000,"Araraquara, Jardim Dumont",https://sp.olx.com.br/regiao-de-ribeirao-preto/imoveis/vendo-para-investimento-casa-alugada-no-jardim-dumont-1467766787
"Apartamento com excelente localização, próximo a supermercados e comércios.",R$ 320.000,"Araraquara, Vila Velosa",https://sp.olx.com.br/regiao-de-ribeirao-preto/imoveis/apartamento-com-excelente-localizacao-proximo-a-supermercados-e-comercios-1472298232
Vende-se apartamento,R$ 190.000,"Araraquara, Jardim América (Vila Xavier)",https://sp.olx.com.br/regiao-de-ribeirao-preto/imoveis/vende-se-apartamento-1472295561
Vendo,R$ 300.000,"Araraquara, Jardim Maria Luiza",https://sp.olx.com.br/regiao-de-ribeirao-preto/imoveis/vendo-1472260763
Casas a venda no Jardim Universal.,R$ 550.000,"Araraquara, Jardim Universal",https://sp.olx.com.br/regiao-de-ribeirao-preto/imoveis/casas-a-venda-no-jardim-universal-1472172615
Oportunidade - (Ótima Localização) Aceita Financiamento**,R$ 320.000,"Araraquara, Parque Laranjeiras",https://sp.olx.com.br/regiao-de-ribeirao-preto/imoveis/oportunidade-otima-localizacao-aceita-financiamento-1449653164
Venda de Apartamentos / Cobertura na cidade de Araraquara,R$ 250.000,"Araraquara, Vila Sedenho",https://sp.olx.com.br/regiao-de-ribeirao-preto/imoveis/venda-de-apartamentos-cobertura-na-cidade-de-araraquara-1472124550
Venda de Casas / Sobrado na cidade de Araraquara,R$ 350.000,"Araraquara, Parque Laranjeiras",https://sp.olx.com.br/regiao-de-ribeirao-preto/imoveis/venda-de-casas-sobrado-na-cidade-de-araraquara-1472102670
Venda de Casas / Padrão na cidade de Araraquara,R$ 350.000,"Araraquara, Parque Residencial Iguatemi",https://sp.olx.com.br/regiao-de-ribeirao-preto/imoveis/venda-de-casas-padrao-na-cidade-de-araraquara-1472102695
Venda de Casas / Condomínio na cidade de Araraquara,R$ 1.980.000,"Araraquara, Parque Residencial Damha",https://sp.olx.com.br/regiao-de-ribeirao-preto/imoveis/venda-de-casas-condominio-na-cidade-de-araraquara-1472102600
"Casa com ótima localização, próximo de mercados e serviços essenciais",R$ 190.000,"Araraquara, Jardim Roberto Selmi Dei",https://sp.olx.com.br/regiao-de-ribeirao-preto/imoveis/casa-com-otima-localizacao-proximo-de-mercados-e-servicos-essenciais-1472096277
"Sobrado com excelente localização, próximo a supermercados e escolas.",R$ 1.100.000,"Araraquara, Jardim Eliana",https://sp.olx.com.br/regiao-de-ribeirao-preto/imoveis/sobrado-com-excelente-localizacao-proximo-a-supermercados-e-escolas-1472096274
Casa à venda na Rua Itália 3 vagas de garagem 250 m² de terreno Churrasqueira,R$ 270.000,"Araraquara, Centro",https://sp.olx.com.br/regiao-de-ribeirao-preto/imoveis/casa-a-venda-na-rua-italia-3-vagas-de-garagem-250-m-de-terreno-churrasqueira-1472050661
Oportunidade Única em ARARAQUARA - SP | Tipo: Apartamento | Negociação: Venda Direta Onlin,R$ 121.487,"Araraquara, Jardim São Rafael I",https://sp.olx.com.br/regiao-de-ribeirao-preto/imoveis/oportunidade-unica-em-araraquara-sp-tipo-apartamento-negociacao-venda-direta-onlin-1471998242
Oportunidade Única em ARARAQUARA - SP | Tipo: Apartamento | Negociação: Venda Direta Onlin,R$ 500.000,"Araraquara, Jardim São Rafael I",https://sp.olx.com.br/regiao-de-ribeirao-preto/imoveis/oportunidade-unica-em-araraquara-sp-tipo-apartamento-negociacao-venda-direta-onlin-1471971380
Casa Vale do Sol Edícula 2 Quartos,R$ 650.000,"Araraquara, Parque Residencial Vale do Sol",https://sp.olx.com.br/regiao-de-ribeirao-preto/imoveis/casa-vale-do-sol-edicula-2-quartos-1471958416
Casa Vale do Sol 3 Quartos e Piscina,R$ 300.000,"Araraquara, Parque Residencial Vale do Sol",https://sp.olx.com.br/regiao-de-ribeirao-preto/imoveis/casa-vale-do-sol-3-quartos-e-piscina-1471954922
Venda de Apartamentos / Padrão na cidade de Araraquara,R$ 320.000,"Araraquara, Jardim Nova Araraquara",https://sp.olx.com.br/regiao-de-ribeirao-preto/imoveis/venda-de-apartamentos-padrao-na-cidade-de-araraquara-1471950351
Venda de Casas / Sobrado na cidade de Araraquara,R$ 121.487,"Araraquara, Centro",https://sp.olx.com.br/regiao-de-ribeirao-preto/imoveis/venda-de-casas-sobrado-na-cidade-de-araraquara-1471950352
Venda de Casas / Condomínio na cidade de Araraquara,R$ 150.000,"Araraquara, Jardim dos Flamboyants",https://sp.olx.com.br/regiao-de-ribeirao-preto/imoveis/venda-de-casas-condominio-na-cidade-de-araraquara-1471950328
Venda de Apartamentos / Padrão na cidade de Araraquara,R$ 135.000,"Araraquara, Jardim dos Manacás",https://sp.olx.com.br/regiao-de-ribeirao-preto/imoveis/venda-de-apartamentos-padrao-na-cidade-de-araraquara-1471950304
Venda de Apartamentos / Padrão na cidade de Araraquara,R$ 1.590.000,"Araraquara, Vila Melhado",https://sp.olx.com.br/regiao-de-ribeirao-preto/imoveis/venda-de-apartamentos-padrao-na-cidade-de-araraquara-1471950323
Oportunidade vendo,R$ 122.091,"Araraquara, Jardim Maria Luiza",https://sp.olx.com.br/regiao-de-ribeirao-preto/imoveis/oportunidade-vendo-1471924898
Oportunidade Única em ARARAQUARA - SP | Tipo: Apartamento | Negociação: Venda Direta Onlin,R$ 126.322,"Araraquara, Jardim São Rafael I",https://sp.olx.com.br/regiao-de-ribeirao-preto/imoveis/oportunidade-unica-em-araraquara-sp-tipo-apartamento-negociacao-venda-direta-onlin-1471913358
Oportunidade Única em ARARAQUARA - SP | Tipo: Apartamento | Negociação: Venda Direta Onlin,R$ 1.700.000,"Araraquara, Jardim São Rafael I",https://sp.olx.com.br/regiao-de-ribeirao-preto/imoveis/oportunidade-unica-em-araraquara-sp-tipo-apartamento-negociacao-venda-direta-onlin-1471911438
Venda de Apartamentos / Padrão na cidade de Araraquara,R$ 135.000,"Araraquara, Jardim Botânico",https://sp.olx.com.br/regiao-de-ribeirao-preto/imoveis/venda-de-apartamentos-padrao-na-cidade-de-araraquara-1471911274
Venda de Casas / Padrão na cidade de Araraquara,R$ 260.000,"Araraquara, Parque das Hortências",https://sp.olx.com.br/regiao-de-ribeirao-preto/imoveis/venda-de-casas-padrao-na-cidade-de-araraquara-1471910767
Oportunidade Única em ARARAQUARA - SP | Tipo: Apartamento | Negociação: Venda Direta Onlin,R$ 170.000,"Araraquara, Jardim São Rafael I",https://sp.olx.com.br/regiao-de-ribeirao-preto/imoveis/oportunidade-unica-em-araraquara-sp-tipo-apartamento-negociacao-venda-direta-onlin-1471909913
Venda de Apartamentos / Padrão na cidade de Araraquara,R$ 170.000,"Araraquara, Jardim Califórnia",https://sp.olx.com.br/regiao-de-ribeirao-preto/imoveis/venda-de-apartamentos-padrao-na-cidade-de-araraquara-1471902465
Venda de Apartamentos / Padrão na cidade de Araraquara,R$ 455.000,"Araraquara, Jardim Residencial Paraíso",https://sp.olx.com.br/regiao-de-ribeirao-preto/imoveis/venda-de-apartamentos-padrao-na-cidade-de-araraquara-1471902408
Venda-Casa de condomínio-Araraquara-Village Damha II,R$ 1.160.000,"Araraquara, Parque Residencial Damha",https://sp.olx.com.br/regiao-de-ribeirao-preto/imoveis/venda-casa-de-condominio-araraquara-village-damha-ii-1471889069
Venda-Apartamento-Araraquara-Centro,R$ 295.000,"Araraquara, Centro",https://sp.olx.com.br/regiao-de-ribeirao-preto/imoveis/venda-apartamento-araraquara-centro-1471889030
Oportunidade Única em ARARAQUARA - SP | Tipo: Apartamento | Negociação: Venda Direta Onlin,R$ 121.487,"Araraquara, Jardim São Rafael I",https://sp.olx.com.br/regiao-de-ribeirao-preto/imoveis/oportunidade-unica-em-araraquara-sp-tipo-apartamento-negociacao-venda-direta-onlin-1471882406
Oportunidade Única em ARARAQUARA - SP | Tipo: Apartamento | Negociação: Venda Direta Onlin,R$ 600.000,"Araraquara, Jardim Panorama",https://sp.olx.com.br/regiao-de-ribeirao-preto/imoveis/oportunidade-unica-em-araraquara-sp-tipo-apartamento-negociacao-venda-direta-onlin-1471882290
Oportunidade Única em ARARAQUARA - SP | Tipo: Apartamento | Negociação: Venda Direta Onlin,R$ 700.000,"Araraquara, Jardim Panorama",https://sp.olx.com.br/regiao-de-ribeirao-preto/imoveis/oportunidade-unica-em-araraquara-sp-tipo-apartamento-negociacao-venda-direta-onlin-1471882254
Oportunidade Única em ARARAQUARA - SP | Tipo: Apartamento | Negociação: Venda Direta Onlin,R$ 1.200.000,"Araraquara, Jardim São Rafael I",https://sp.olx.com.br/regiao-de-ribeirao-preto/imoveis/oportunidade-unica-em-araraquara-sp-tipo-apartamento-negociacao-venda-direta-onlin-1471882079
"Casa ampla 4 suítes, Araraquara/SP",R$ 360.000,"Araraquara, Jardim Primavera",https://sp.olx.com.br/regiao-de-ribeirao-preto/imoveis/casa-ampla-4-suites-araraquara-sp-1471879488
Venda de Apartamentos / Padrão na cidade de Araraquara,R$ 535.000,"Araraquara, Centro",https://sp.olx.com.br/regiao-de-ribeirao-preto/imoveis/venda-de-apartamentos-padrao-na-cidade-de-araraquara-1471879008
Venda de Apartamentos / Padrão na cidade de Araraquara,R$ 135.000,"Araraquara, Vila Santana",https://sp.olx.com.br/regiao-de-ribeirao-preto/imoveis/venda-de-apartamentos-padrao-na-cidade-de-araraquara-1471878995
Venda de Casas / Padrão na cidade de Araraquara,R$ 600.000,"Araraquara, Jardim Primavera",https://sp.olx.com.br/regiao-de-ribeirao-preto/imoveis/venda-de-casas-padrao-na-cidade-de-araraquara-1471878833
Venda de Apartamentos / Padrão na cidade de Araraquara,R$ 260.000,"Araraquara, Centro",https://sp.olx.com.br/regiao-de-ribeirao-preto/imoveis/venda-de-apartamentos-padrao-na-cidade-de-araraquara-1471878842
Venda de Casas / Padrão na cidade de Araraquara,R$ 200.000,"Araraquara, Condomínio Parque dos Sabiás",https://sp.olx.com.br/regiao-de-ribeirao-preto/imoveis/venda-de-casas-padrao-na-cidade-de-araraquara-1471878852
Apartamento Padrão em Araraquara,R$ 170.000,"Araraquara, Jardim Quitandinha II",https://sp.olx.com.br/regiao-de-ribeirao-preto/imoveis/apartamento-padrao-em-araraquara-1471870760
"Lindo Apartamento, localizado próximo ao Shopping Jaraguá.",R$ 155.000,"Araraquara, Jardim Residencial Elvio Lupo",https://sp.olx.com.br/regiao-de-ribeirao-preto/imoveis/lindo-apartamento-localizado-proximo-ao-shopping-jaragua-1471870440
"Casa com excelente localização, próximo a supermercados e comércios.",R$ 170.000,"Araraquara, Jardim das Estações (Vila Xavier)",https://sp.olx.com.br/regiao-de-ribeirao-preto/imoveis/casa-com-excelente-localizacao-proximo-a-supermercados-e-comercios-1471870458
Lindo apartamento,R$ 700.000,"Araraquara, Centro",https://sp.olx.com.br/regiao-de-ribeirao-preto/imoveis/lindo-apartamento-1471870450
"Casa com boa localização, próximo a escolas e creches.",R$ 455.000,"Araraquara, Vila Vieira (Vila Xavier)",https://sp.olx.com.br/regiao-de-ribeirao-preto/imoveis/casa-com-boa-localizacao-proximo-a-escolas-e-creches-1471870459
Apartamento Padrão em Araraquara,R$ 200.000,"Araraquara, Vila Sedenho",https://sp.olx.com.br/regiao-de-ribeirao-preto/imoveis/apartamento-padrao-em-araraquara-1471870466
"Casa com 3 dormitórios à venda, 158 m² por R$ 1.160.000,00 - Parque Residencial Damha - Ar",R$ 1.160.000,"Araraquara, Parque Residencial Damha",https://sp.olx.com.br/regiao-de-ribeirao-preto/imoveis/casa-com-3-dormitorios-a-venda-158-m-por-r-1-160-000-00-parque-residencial-damha-ar-1471852630
